<?xml version="1.0" encoding="UTF-8"?>
<xs:schema xmlns:xs="http://www.w3.org/2001/XMLSchema">
	<xs:element name="futbol">
		<xs:complexType>
			<xs:sequence>
				<xs:element name="equipo" maxOccurs="20">
					<xs:complexType>
						<xs:sequence>
							<xs:element name="nombre" type="xs:string"/>
							<xs:element name="ciudad" type="xs:string"/>
							<xs:element name="entrenador" type="xs:string"/>
							<xs:element name="jugadores">
								<xs:complexType>
									<xs:sequence>
										<xs:element name="jugador" maxOccurs="22">
											<xs:complexType>
												<xs:sequence>
													<xs:element name="nombre" type="xs:string"/>
													<xs:element name="nacionalidad" type="xs:string"/>
												</xs:sequence>
												<xs:attribute name="posicion" type="xs:string"/>
												<xs:attribute name="dorsal" type="xs:byte">
												</xs:attribute>
											</xs:complexType>
										</xs:element>
									</xs:sequence>
								</xs:complexType>
							</xs:element>
						</xs:sequence>
					</xs:complexType>
				</xs:element>
			</xs:sequence>
		</xs:complexType>
	</xs:element>
</xs:schema>